{
  "component" : "ComponentA",
  "listOfCompanies" : [ {
    "name" : "Company A",
    "email" : "test.mail@example.com",
    "cxBusinessPartnerNumber" : "BPNL000000000123"
  } ],
  "qualityTaskId" : "Qtask_2xckuQ",
  "description" : "Please evaluate why there is a high number of customer complaints with ComponentA if the vehicle is between 10000-30000km.",
  "creationDate" : "2022-11-11",
  "title" : "Evaluation of ComponentA in CarmodelB in country DE",
  "status" : "new",
  "dataDeletion" : "delete-data-after-closing"
}